{
  "hardware": {
    "cpu": "Apple M5 Pro",
    "cpuCores": 18,
    "gpuCount": 1,
    "hardwareName": "Apple M5 Pro",
    "hwClass": "UNIFIED",
    "memTierGb": 32,
    "os": "macos",
    "ramGb": 64.0,
    "unifiedMemory": false,
    "vramGb": 64.0
  },
  "results": [
    {
      "avgOutputTokens": 148.67,
      "avgTotalMs": 3989.6,
      "avgTps": 36.85,
      "avgTtftMs": null,
      "maxTps": 39.26,
      "minTps": 35.65,
      "model": "qwen3.8-flash-next",
      "numRuns": 3,
      "provider": "llamacpp"
    }
  ],
  "schemaVersion": 1,
  "submittedAtUnix": 1789782407,
  "tool": {
    "name": "llmfit",
    "version": "1.1.15"
  }
}