{
  "hardware": {
    "cpu": "Intel(R) Core(TM) i5-3230M CPU @ 2.60GHz",
    "cpuCores": 4,
    "gpuCount": 0,
    "hardwareName": "Intel 3rd Gen Core processor Graphics Controller (integrated)",
    "hwClass": "UNIFIED",
    "memTierGb": 16,
    "os": "linux",
    "ramGb": 14.52,
    "unifiedMemory": true,
    "vramGb": 15.52
  },
  "results": [
    {
      "avgOutputTokens": 215.67,
      "avgTotalMs": 81241.17,
      "avgTps": 2.99,
      "avgTtftMs": 8765.74,
      "maxTps": 3.02,
      "minTps": 2.97,
      "model": "nemotron-3-nano:4b-hv-cpu-12288k",
      "numRuns": 4,
      "provider": "ollama"
    }
  ],
  "schemaVersion": 1,
  "submittedAtUnix": 1791463067,
  "tool": {
    "name": "llmfit",
    "version": "1.1.16"
  }
}