{
  "hardware": {
    "cpu": "Apple M5 Pro",
    "cpuCores": 18,
    "gpuCount": 2,
    "hardwareName": "Apple M5 Pro",
    "hwClass": "UNIFIED",
    "memTierGb": 64,
    "os": "macos",
    "ramGb": 64.0,
    "unifiedMemory": true,
    "vramGb": 64.0
  },
  "results": [
    {
      "avgOutputTokens": 200.0,
      "avgTotalMs": 2232.63,
      "avgTps": 139.11,
      "avgTtftMs": 26.98,
      "maxTps": 142.53,
      "minTps": 131.21,
      "model": "gemma4:e4b-mlx",
      "numRuns": 3,
      "provider": "ollama"
    }
  ],
  "schemaVersion": 1,
  "submittedAtUnix": 1785334082,
  "tool": {
    "name": "llmfit",
    "version": "1.1.6"
  }
}