{
  "hardware": {
    "cpu": "Intel(R) Core(TM) i5-9500T CPU @ 2.20GHz",
    "cpuCores": 6,
    "gpuCount": 1,
    "hardwareName": "Intel CoffeeLake-S GT2 [UHD Graphics 630] (integrated)",
    "hwClass": "UNIFIED",
    "memTierGb": 32,
    "os": "linux",
    "ramGb": 32.15,
    "unifiedMemory": false,
    "vramGb": 30.15
  },
  "results": [
    {
      "avgOutputTokens": 214.0,
      "avgTotalMs": 32662.58,
      "avgTps": 6.01,
      "avgTtftMs": 636.51,
      "maxTps": 7.66,
      "minTps": 5.95,
      "model": "qwen2.5:3b",
      "numRuns": 3,
      "provider": "ollama"
    }
  ],
  "schemaVersion": 1,
  "submittedAtUnix": 1788320075,
  "tool": {
    "name": "llmfit",
    "version": "1.1.12"
  }
}