{
  "hardware": {
    "cpu": "13th Gen Intel(R) Core(TM) i7-1365U",
    "cpuCores": 11,
    "gpuCount": 1,
    "hardwareName": "Intel Raptor Lake-P [Iris Xe Graphics] (integrated)",
    "hwClass": "UNIFIED",
    "memTierGb": 32,
    "os": "linux",
    "ramGb": 32.0,
    "unifiedMemory": false,
    "vramGb": 31.0
  },
  "results": [
    {
      "avgOutputTokens": 286.0,
      "avgTotalMs": 128009.53,
      "avgTps": 2.37,
      "avgTtftMs": 6692.44,
      "maxTps": 2.44,
      "minTps": 2.33,
      "model": "gemma4-12b-coder-fable5-latest-enfixed-agent-cpu:latest",
      "numRuns": 3,
      "provider": "ollama"
    }
  ],
  "schemaVersion": 1,
  "submittedAtUnix": 1788756662,
  "tool": {
    "name": "llmfit",
    "version": "1.1.14"
  }
}