{
  "hardware": {
    "cpu": "Apple M2 Pro",
    "cpuCores": 13,
    "gpuCount": 2,
    "hardwareName": "Apple M2 Pro",
    "hwClass": "UNIFIED",
    "memTierGb": 32,
    "os": "macos",
    "ramGb": 64.0,
    "unifiedMemory": true,
    "vramGb": 32.0
  },
  "results": [
    {
      "avgOutputTokens": 184.67,
      "avgTotalMs": 8433.29,
      "avgTps": 21.97,
      "avgTtftMs": null,
      "maxTps": 22.06,
      "minTps": 21.82,
      "model": "Meta-Llama-3.1-8B-Instruct-Q8_0.gguf",
      "numRuns": 2,
      "provider": "llamacpp"
    }
  ],
  "schemaVersion": 1,
  "submittedAtUnix": 1789262400,
  "tool": {
    "name": "llmfit",
    "version": "1.1.15"
  }
}