{
  "hardware": {
    "cpu": "Intel(R) Core(TM) i7-8700K CPU @ 3.70GHz",
    "cpuCores": 11,
    "gpuCount": 1,
    "hardwareName": "NVIDIA GeForce RTX 2080",
    "hwClass": "DISCRETE_GPU",
    "memTierGb": 8,
    "os": "windows",
    "ramGb": 31.89,
    "unifiedMemory": false,
    "vramGb": 9.0
  },
  "results": [
    {
      "avgOutputTokens": 157.0,
      "avgTotalMs": 2750.2,
      "avgTps": 70.34,
      "avgTtftMs": 56.07,
      "maxTps": 62.14,
      "minTps": 59.55,
      "model": "qwen3:4b-instruct-2507-q8_0",
      "numRuns": 3,
      "provider": "ollama"
    }
  ],
  "schemaVersion": 1,
  "submittedAtUnix": 1789239218,
  "tool": {
    "name": "llmfit",
    "version": "1.1.15"
  }
}