{
  "hardware": {
    "cpu": "AMD Ryzen 7 9800X3D 8-Core Processor",
    "cpuCores": 16,
    "gpuCount": 1,
    "hardwareName": "AMD Radeon RX 7900 XT",
    "hwClass": "DISCRETE_GPU",
    "memTierGb": 16,
    "os": "linux",
    "ramGb": 59.44,
    "unifiedMemory": false,
    "vramGb": 19.98
  },
  "results": [
    {
      "avgOutputTokens": 300.0,
      "avgTotalMs": 1921.84,
      "avgTps": 160.79,
      "avgTtftMs": 35.89,
      "maxTps": 179.15,
      "minTps": 143.36,
      "model": "gemma4:e4b",
      "numRuns": 2,
      "provider": "ollama"
    }
  ],
  "schemaVersion": 1,
  "submittedAtUnix": 1792394378,
  "tool": {
    "name": "llmfit",
    "version": "1.1.17"
  }
}