{
  "hardware": {
    "cpu": "AMD Ryzen 5 5500GT with Radeon Graphics",
    "cpuCores": 12,
    "gpuCount": 1,
    "hardwareName": "Radeon RX 9060 XT",
    "hwClass": "DISCRETE_GPU",
    "memTierGb": 16,
    "os": "linux",
    "ramGb": 74.5,
    "unifiedMemory": true,
    "vramGb": 15.92
  },
  "results": [
    {
      "avgOutputTokens": 206.67,
      "avgTotalMs": 4547.58,
      "avgTps": 42.9,
      "avgTtftMs": null,
      "maxTps": 45.8,
      "minTps": 40.21,
      "model": "Qwen2.5-Coder-7B-Instruct-Q6_K",
      "numRuns": 3,
      "provider": "llamacpp"
    }
  ],
  "schemaVersion": 1,
  "submittedAtUnix": 1787953826,
  "tool": {
    "name": "llmfit",
    "version": "1.1.11"
  }
}